Key,Category,Pain,Solution Hint,Mentions,Total Likes,Example Post IDs
verification-issues,monetization,The user has repeatedly failed the verification process on Fanvue.,Ensure compliance with verification requirements before reapplying.,30,96,fanvue-verification-failed;fanvue-likes-and-tick;need-help-with-fanvue-verification-2;cant-verify-fanvue-in-my-country;help-setting-up-fans
content-creation-issues,results,Uncertainty about using face swap after creating content.,Clarify your workflow and experiment with different methods.,16,56,trouble-right-now-making-content;make-content;nudes-content;update-2;ai-outfit-changes
access-issues,support,The user cannot find access to coaching or replays after unlocking level 3.,Reach out to support for guidance on accessing content.,13,28,ive-unlocked-level-3-but-i-still-cant-find-where-to-accesses-the-coaching-or-the-replays-is-it-just-me;shutterswapai-not-working-help;shutterswapai-3;shutterswapai-4;sdlxppv
model-face-evaluation,results,"The user is unsure if the model's face is consistent across multiple images, leading to uncertainty about the quality of the model.",Consider using a processing tool to ensure consistency.,12,84,please-rate-the-models-face-only-7d2920ff;please-rate-the-models-face-only;please-rate-the-models-face-only-3115734a;please-rate-the-models-face-only-c9aafc76;please-rate-the-models-face-only-54e42c7a
image-quality-issues,results,Image quality from AI models is not meeting expectations.,Consider learning advanced tools for better results.,12,40,where-to-start;do-you-know-why-pykaso-gives-me-bad-mirror-pics;nsfw-can-you-spot-the-flaws;pykaso-generating-bad-images;thoughts-on-my-first-pics-generated
low-engagement,platform,User is struggling to get likes and views on Instagram and Threads.,Consider collaborating with others to increase visibility.,12,34,traffic-issue;how-to-get-social-media-followers;my-second-attempt;instagram-posting;update-40-subscribers-350-followers
face-swap-issues,results,Issues with face swap functionality not yielding expected results.,Adjust your approach or seek alternative tools.,12,26,face-swap-for-nsfw-on-pykaso;face-swap-failure;thoughts-on-my-model;face-swap-help;faceswap-5e4b1d83
nsfw-content-creation,results,I'm looking for tips on how to create NSFW content.,Research best practices and community guidelines for NSFW content.,11,23,nsfw-dc5a23df;advice-2;creating-pictures;nsfw-4a82490a;nsfw-videos-88af9469
shadowban-concerns,platform,Concern about potential shadowban while trying to use a hotspot for Instagram.,Research best practices for using hotspots without risking account penalties.,10,36,question-about-using-a-hotspot-safely-without-risking-shadowban;how-did-you-pass-the-shadowban;insta-reels-feedback;do-we-need-a-new-phone-simcard;do-you-think-im-shadowbanned
conversion-issues,results,"Clients in chat seem uninterested in converting to paid subscriptions, leading to frustration.",Try offering exclusive content or incentives to encourage conversions.,10,33,ig-chat-conversions;failed-ig-sales-closing;need-helpp;first-results-2;no-conversions
payment-issues,monetization,User is unable to make a payment to subscribe on Kling.,Check payment method compatibility or contact support for assistance.,9,32,hello-guys-cfb59257;pykaso-is-not-accepting-payments;problem-with-pykaso;blocked-while-trying-to-recharge-green-coins-to-train-my-ai-model-has-anyone-faced-this-issue-hey-everyoneim-writing-here-because-im-facing-a-really-frustrating-situation-and-could-use-your-support;do-you-guys-use-fanvue
account-suspension,platform,The user's Treads account has been suspended without any prior warning.,Contact Treads support for clarification and possible reinstatement.,8,29,treads-suspension;fanvue-suspended;ig-suspended-during-warm-up;instagram-suspension-2;my-instagram-suspended
account-creation-issues,platform,Unable to create a Fanvue account due to country restrictions.,Explore other platforms that may not have such restrictions.,8,19,banned-country;fanvue-account-3;fanvue-account-2;second-fanvue;problem-with-fanvu-account-creation
engagement-issues,workflow,Not receiving follower returns after following and unfollowing on Instagram.,Consider spacing out follow/unfollow actions to avoid detection.,7,32,follows-not-going-though-on-instagram;reel-flop;reels-and-interaction;i-cant-monetize;day-12-instagram-dead
image-generation-issues,results,User is struggling to generate a specific image despite trying various prompts.,Consider simplifying the prompt or using different reference images.,7,31,how-would-you-fix-these-images;first-problem;pictures-with-same-background;same-background-2;different-hair-color
prompt-issues,results,Struggling to find effective prompts for generating specific content.,Collaborate with others to share successful prompts.,7,25,need-help-with-a-prompt;help-she-looks-possessed;kling-2;what-prompts-change-camera-and-model-poses-in-sdxl-ppv;crazy-with-the-prompts
model-consistency-issues,results,User is facing challenges with consistency in content due to the chosen model's figure.,Consider switching to a more standard model for better results.,7,16,hourglass-figure-model-messing-up-consistency-should-i-switch;model-lost-the-face-i-made;help-31bb263b;first-model-feedback;hey-guys-4
image-consistency-issues,results,User is struggling with generating consistent images for their AI model.,Experiment with different training images and techniques.,6,22,monica-glazi;model-4;not-the-same-girl-when-generating-images;eye-color-2;the-face-of-my-model-is-not-looking-anymore-same
video-quality-issues,results,User is seeking help with improving video quality for their content.,Experiment with different editing techniques and tools.,6,14,what-do-you-think-89b991d8;best-app-for-reels;kling-ai-3;the-ai-video-looks-off;video-generator
onboarding-issues,onboarding,User forgot to follow certain accounts during a warm-up phase and is unsure how to rectify this without starting over.,Check if you can follow the accounts now without resetting the progress.,5,27,guys-help;old-vs-new-e-mail;second-ai-influencer;ig-account;trouble-creating-an-instagram-account-for-an-ai-model
content-creation-clarity,results,User is unsure about the appropriateness of using face-swapped videos for reels.,Clarify content guidelines for reels.,5,24,quick-question-for-the-group;quick-question-for-everyone-here;how-to-generate-couple-photos-with-same-clothes-with-different-positions;hello-guys-4;seducedcom-4
tooling-issues,tooling,Facing numerous errors when trying to create specific content using Pykaso.,Consult tutorials or community resources for troubleshooting common errors.,5,21,how-do-you-use-pykaso-for-naked-pictures-i-got-a-lot-of-errors;help-99757432;ai-videos-in-pykaso;editing-specific-pictures;pykaso-is-in-maintainance
model-creation-issues,results,Encountering issues with overly sexual results and distorted features.,Refine your prompts and model settings for better control.,5,15,my-first-time-creating-my-ai-model;i-cant-create-a-model-body-in-sdxl;flux-cannot-handle-groups-of-people-well;what-do-you-think-of-this-norvegianicelandic-girl;nsfw-prompting
following-issues,platform,The user is unable to follow anyone on the platform due to a pending status.,Contact support for assistance with account restrictions.,5,14,pls-help;following-accounts-2;following-accounts;problem-to-follow-people;i-have-problem-with-ig-following-accounts
account-banning-issues,platform,"The user’s account was banned without clear reason, causing frustration.",Contact support for clarification and appeal the ban.,5,13,banned-2;banned-from-the-community;got-banned-on-ig;half-of-the-followers-acquired;banned-again
content-creation-uncertainty,workflow,The user is unsure about what content to post on Fanvue.,Analyze successful accounts for content ideas.,5,11,fanvue-a62429f8;video-content;need-help-bba80027;nude-lora;intro-video-to-fanvue
model-selection-issue,tooling,The SDXL PPV model is missing from the dropdown selection when trying to generate images.,Check for updates or reach out to support for assistance.,5,11,sdxl-ppv-missing;how-to-get-sdxl-ppv-on-pykasoai;help-7f81fcd4;censored-with-sdxl-ppv;help-me-please-choosing-the-nudes-model-on-pykaso
realism-issues,results,User is not satisfied with the realism of results from Kling.,Share tips for improving realism in video outputs.,5,11,tips-for-reels-with-kling;help-4a98f9d2;what-do-you-think-4014845a;my-first-ai-girl-4;upscale-3
content-quality-issues,results,"Pykaso censors images, and the results are not realistic.",Consider using a different platform for NSFW content creation.,4,18,not-get-good-content-pykaso;how-do-u-make-your-nsfw-content;consistency-issues;first-ig-reel-what-could-i-improve
verification-process-issues,platform,The user is having trouble with the verification process on Uncove.,Seek assistance from Uncove support.,4,17,having-trouble-with-uncove;instagram-verification;uncove-verification-77263067;seducedcom-2
content-creation-challenges,workflow,"Difficulty in converting interest from DMs into actual sales, with many potential customers unwilling to pay.",Consider offering free trials or samples to convert interest into sales.,4,16,help-0514e8b4;nsfw-content-creators-need-tips;successfully-ending-my-day-2-journey;i-need-help-with-my-model-ai-videos
communication-issues,workflow,Should I initiate conversations with new friends on Instagram?,Engage with them to build connections.,4,15,chatting;nsfw-videos-3;just-started-200-followers-and-10-subs;insta-chatting-2
conversion-challenges,monetization,The user finds it takes too long to convert chat interactions into tips.,Explore strategies to enhance engagement and conversion rates.,4,15,first-payments-3;convert-from-dm-to-fanvue;curious-what-youd-do-in-this-situation-sent-link-but-he-got-emotional;how-to-make-conversions
nsfw-content-generation,results,User is unable to generate NSFW content using Pykaso.,Explore alternative platforms or settings for NSFW content.,4,12,problem-with-nsfw;my-first-model-help;nsfw-photos-plugg;how-to-generate-nsfw-content
account-banned,platform,User is unsure if they are banned from Threads after receiving a notification about an appeal.,Check the platform's support for clarification on account status.,4,10,threads-bann;fanvue-banned-in-my-country;fanvue-banned-me-before-i-even-could-start-it-what-should-i-do;banned
editing-issues,need-help,How do I edit the extra hand out?,Use editing software to remove unwanted elements.,4,10,help-4fcaab5b;how-can-i-edit-the-piercing-out;missing-hair-color;how-to-edit-out-something
platform-access-issue,tooling,User is unable to access Shutter Swap AI and seeks alternatives for purchasing nude photos.,Explore other platforms that offer similar services.,4,9,shutter-swap-not-loading;shutterswap-isnt-working;shutterswap-is-not-working;platform-suggestion
nsfw-content-creation-issues,results,Struggling to create NSFW content that matches the desired model.,Refine your prompts and explore different content creation methods.,4,6,nsfw-content-ca8116dd;undressing-my-existing-ai-character;questions-about-the-nsfw-part-of-the-model;question-about-nsfw
site-access-issues,tooling,User is unable to find where to buy face swap videos as the suggested site seems to be down.,Search for alternative platforms or forums for recommendations.,4,6,shutterswapai;shutterswap-alternative-2;the-video-site-shutterswap;shutterswap-4
tooling-glitches,tooling,"User is experiencing glitches with Pykaso, specifically not being able to see a face-swapped video.",Try restarting the app or checking for updates.,3,17,is-pykaso-glitching-for-anyone-else;face-swap-dont-work;confused
strategy-issues,workflow,User is uncertain about how to grow their Instagram account after a period of inactivity.,Focus on consistent posting and engaging with followers.,3,14,what-do-i-do-with-my-insta-now;reelspost;question-09a899b4
platform-issues,platform,User is experiencing issues with Shutterswap not working.,Suggest checking for updates or alternatives.,3,13,shutterswap-not-working;seduced-problems;what-up-with-pykaso
lack-of-sales,monetization,"Despite having followers, I'm struggling to convert them into paying subscribers.",Seek advice on effective sales strategies.,3,13,motivation-4;no-result;going-through-many-talking-stages
verification-delay,platform,The user is waiting for ID verification from Uncove and is unsure how long it takes.,Reach out to Uncove support for estimated verification times.,3,12,uncove-5c7e800c;id-verification-process;uncove-verification-4
sales-strategy-issues,monetization,User is not making sales and is unsure about effective strategies.,Explore diverse content types and engagement strategies.,3,10,why-you-dont-making-sales;need-help-on-sales;struggling
model-appearance-issues,results,User's AI model is generating unwanted hand poses.,Adjust training data to minimize undesired poses.,3,10,finally-trained-my-ai;say-hello-to-my-little-friend;my-first-ai-model-to-skinny-and-to-atletic-body
video-generation-issue,tooling,User cannot generate videos using Hey Gen.,Check for software updates or troubleshooting guides.,3,10,hey-gen-not-working;where-can-i-generate-sexual-videos-for-fanvue;is-anyone-having-this-issue
targeting-us-audience,monetization,User wants to target a US audience but is facing challenges due to not being a US citizen and concerns about VPN usage.,Explore alternative methods for audience targeting that comply with platform policies.,3,9,us-audience-targeting;american-ig-audience;how-to-target-us-audience-when-youre-outside-of-us
legal-concerns,platform,User is worried about the legality of generating NSFW content in their country.,Share legal resources and advice for content creators.,3,9,legality-issues-in-countries-like-in-india;any-legal-issues;probably-a-dumb-question
upscaling-issues,tooling,Unable to upscale images in Pykaso.,Check for updates or alternative upscaling tools.,3,8,cant-upscale;help-99ef9217;what-do-you-think-guys
inconsistent-results,results,The face swap results are inconsistent across different images.,Adjust the input images for better consistency.,3,8,face-swap-48f771e5;partners-needed;pykaso-help-me
account-banning,platform,"User's Fanvue account was banned after a warning, and they are seeking help to retrieve it.",Contact Fanvue support for assistance with account recovery.,3,8,my-fanvue-account-got-temporarily-banned-after-i-received-a-final-warning-need-help;ig-bans;new-ig-acc-banned-and-asked-for-video-verification
posting-issues,platform,User is frustrated because they cannot post a reel on Instagram.,Check Instagram's guidelines or troubleshoot the app.,3,8,help-4a5c0275;instagram-2f4799ec;threads-not-working
account-setup-issues,workflow,User is confused about the account setup process on Fanvue.,Provide a detailed guide for setting up Fanvue accounts.,3,8,question-on-setting-up-fanvue-account-2;do-i-need-to-have-a-usa-number-or-live-in-the-us;question-on-setting-up-fanvue-account
training-steps-uncertainty,results,User is unsure about the optimal number of training steps for their AI model.,Consult community best practices for training AI models.,3,7,this-is-a-big-step;just-asking;some-help-please
video-generation-issues,tooling,User is facing issues generating videos with Pykaso.,Check for updates or troubleshooting tips.,3,7,pykaso-videos-problems;help-for-i2v-generation;dancing-videos
model-training-issues,workflow,User wants to know if they can use multiple celebrity bodies for training.,Clarify the guidelines for using multiple references in training.,3,7,question-b160f871;problem-with-model-training;pykasso-issues
account-banning-issue,platform,The user's new Instagram account was banned after verification.,Consider reviewing Instagram's policies to avoid future issues.,3,7,instagram-5dc982c9;threads-account;help-4e1907ec
content-restriction,tooling,"User is facing restrictions on generating NSFW content with KlingAI, leading to frustration.",Consider using alternative tools that support NSFW content.,3,6,yes-kling-does-not-allow-nsfw;help-18-content;nsfw-video
face-swap-issue,tooling,"The face swap feature is not producing the desired results, leading to mismatched appearances between the generated character and the intended face.",Consider adjusting the input parameters or using a different face reference.,3,6,problem-with-face-swap;help-again;face-swap-2
video-creation-issues,tooling,User is unable to create hot videos due to restrictions from Kinglai.,Explore alternative video creation tools.,3,6,hot-videos;heelpp;3-hours-in-rate-my-model
training-issues,workflow,User's model has inconsistencies due to multiple hair colors.,Suggest methods for training models with consistent features.,3,6,model-feedback-please;having-trouble-training-my-ai-model;i-tried-retraining-my-model-again-in-pikaso-lool
nsfw-image-generation-issues,results,Generating NSFW images with Pykaso is not yielding good results.,Consider using different tools or techniques for better outcomes.,3,5,going-forward;struggling-to-make-nsfw-images-with-my-model-on-pyscaso;final-ai-model
faceswap-quality-issues,results,Struggling with poor quality in face swaps for NSFW images.,Look for alternative faceswap tools that offer better results.,3,5,someone-know-a-good-faceswap-tool;what-is-the-best-tool-fur-faceswaps;face-swapupscale
poor-faceswap-results,results,User is struggling to achieve good results with face swap functionality.,Seek tips from experienced users on effective face swap techniques.,3,5,most-of-people-dont-know-this;whats-your-best-faceswap-program;realistic-photos
platform-access-issues,platform,User cannot find a specific feature in Pykaso.,Provide a guide on accessing features in Pykaso.,3,4,help-me-886471c4;help-me-please;kindly-help
age-restriction-issues,platform,"Fanvue requires ID verification, but the user is under 18.",Wait until eligible or seek platforms with lower age restrictions.,3,4,starting;legal-age;under-18-years-of-age
workflow-issues,workflow,User is struggling to get their first subscribers and is unsure why.,Evaluate your outreach strategy and consider adjusting your approach.,2,13,roadmap;i-feel-completely-lost
scheduling-issues,tooling,Unable to find the scheduling option in Metricool after turning the account professional.,Check for updates or support documentation for Metricool.,2,12,question-about-metricool;scheduling-posts
lack-of-guidance,onboarding,User is looking for a step-by-step guide on how to use seduce.com to save money.,Provide a comprehensive tutorial or guide.,2,11,seduce-ai;tutorial-for-wwwseducedcom
monetization-issues,monetization,Experiencing financial losses due to issues with Uncove and Fanvue.,Investigate alternative platforms or payment methods to mitigate losses.,2,11,missing-out-money;what-are-normal-prices
automation-issues,workflow,Uncertainty about the reliability of AI automation for managing subscriber chats on Fanvue.,Test the automation features on a small scale before fully implementing them.,2,11,chatbot-chat-automation;is-there-automation
results-issues,results,"User's first reel post received very few views, contrary to expectations.",Consider optimizing posting times and engagement strategies.,2,11,first-reel-post-after-day-5-warm-up;soo-close-yet-so-far
low-sale-price,monetization,"User's sale price is too low, indicating potential undervaluation.",Reassess pricing strategy based on market value.,2,11,first-sale;got-another-sale-this-one-was-for-8-which-is-still-too-low
monetization-challenges,monetization,The user is unable to monetize chats despite high engagement.,Explore different monetization strategies or platforms.,2,10,monetize-chats;hmm-soft-content-is-the-best
pricing-clarity,monetization,I need ideas on what to charge for pics or videos on Fanvue.,Research competitor pricing or community recommendations.,2,10,fanvue-pricing;getallmylinks
budget-constraints,monetization,Struggling with a low budget while trying to use Pykasso.,Look for budget-friendly alternatives or free resources.,2,10,lets-level;need-help-with-pykaso
image-anomalies,results,Confusion about why certain images of models appear with odd features.,Seek advice on image generation techniques.,2,10,weird-boobs;do-you-see-something-wrong-in-the-pic
platform-comparison,tooling,Uncertainty about which platform yields better results for content creation.,Share experiences with different platforms.,2,10,platformsite;threads-vs-x
ai-training-issues,tooling,Stuck in the AI learning phase due to interface differences.,Seek guidance on the correct interface usage.,2,10,i-am-so-stuck-right-now;question-343900f6
service-quality-issues,jobs,Received poor quality work from a hired individual despite clear instructions.,Vet freelancers more thoroughly before hiring.,2,9,feedback-dont-hire-kelvin-godfrey;what-the-hell-pykaso
technical-issues,tooling,Encountering technical problems while training the AI model.,Collaborate with the community to troubleshoot and find solutions.,2,9,issues-with-pykaso-in-creating-ai-content-has-anyone-found-a-solution;newbie-question
missing-options,tooling,Unable to access the SDXL option for content creation.,Check settings or reach out for support.,2,9,need-help-b7346d7d;3-option-is-missing-with-pykaso
inconsistent-facial-features,results,"The AI-generated face looks different each time, which is frustrating after following the training instructions.",Ask for tips on stabilizing facial features in AI generation.,2,9,why-does-my-ai-girl-look-different;how-are-you-getting-consistent-faces-of-your-model
bio-link-timing,workflow,Uncertain about the best time to put my links in the bio section.,Experiment with different timings and track engagement.,2,9,getallmylinks-in-bio-best-time;question-for-noct
content-consistency-issues,results,User is working on improving consistency in their NSFW content.,Seek feedback on specific content pieces.,2,8,nsfw-content-8e7b3e8e;consistent-nsfw
shadowban,platform,"Users are experiencing shadowbans when they start following others, which limits their engagement.",Investigate best practices for avoiding shadowbans on social media.,2,8,shadowban-3;accounts-keep-getting-shadowbanned-or-restricted-at-day-2
tracking-issues,workflow,"Users are not tracking their traffic effectively across platforms, which hampers their ability to optimize efforts.",Implement tracking links to monitor traffic sources and performance.,2,8,tracking-links-track-your
verification-wait-time,onboarding,User is inquiring about the time it takes to get verified on Uncover.,Provide information on the verification process.,2,8,how-long-does-it-take-to-get-verified-on-uncover;uncove-vip-verification
account-management-issues,workflow,The user is unsure whether to start a new account or revive an old one.,Evaluate the potential of the existing account before deciding.,2,8,yo-bros-some-questions;old-instagram-account
support-issues,monetization,User is frustrated with Fanvue's support after being asked to verify a third party.,Escalate the issue through official support channels.,2,7,fanve-legit;can-any1-just-be-specific
lack-of-resources,tooling,There are no videos or anything for level 3.,Reach out to the community for shared resources.,2,7,level-3-4;sdxl-tutorial
payout-issues,monetization,User has not met the payout threshold on Fanvue and is looking for alternatives.,Explore other platforms with lower payout thresholds.,2,7,anyone-tried-fanplace-or-another-alt;fanvue-payouts
verification-requirements,platform,User is concerned about Fanvue's verification process for AI content creators.,Stay updated on platform policies and compliance.,2,7,fanvue-asking-for-proof-that-underlying-dataset-training-is-full-ai;uncove-verification-3
realism-concerns,feedback,User is unsure if their AI model looks realistic enough and is seeking opinions.,Gather feedback from the community before proceeding with more content.,2,7,can-i-have-your-guys-opinion;the-realism-of-ai-content
lack-of-support,community,"Users feel unsupported in their training efforts, leading to frustration and stagnation.",Encourage community engagement and support initiatives.,2,7,there-is-no-updates-on-the-training-people-dont-help-to-level-up;this-coursecommunity-is-cooked
leveling-up-issues,community,User is seeking help to level up to level 3 for private communication.,Encourage community support for leveling up.,2,7,need-help-with-leveling-up;level-up-on-skool
visibility-issues,platform,"User cannot find their posts or reels when searching for hashtags, indicating potential shadowban.",Review account activity and consider reaching out for support.,2,7,i-cannot-find-my-postsreels-when-searching-for-hashtag;ig-ai-detection
identity-verification-issues,platform,Challenges with identity verification for Meta verification.,Consider using a consistent profile name and photo.,2,6,meta-verified-2;meta-verified
conversion-strategy-uncertainty,monetization,User is unsure about the effectiveness of their Linktree setup for conversions.,Test different link configurations to optimize conversions.,2,6,link-tree-conversion-rate;subscribers-after-2-dayshow-to-convert
lack-of-traction,results,Is anyone getting no traction with your AI and Instagram?,Evaluate your content strategy and engagement tactics.,2,6,results-4;instagram-b078c151
consistency-issues,results,Struggling to maintain consistency in content creation with AI.,Review training materials and adjust input parameters.,2,6,consistency-on-sdlx-ppv-content-2;how-do-you-get-consistency-for-ai-bodies
content-visibility-issues,monetization,Struggling to make content go viral and convert to sales.,Utilize social media strategies to enhance visibility.,2,6,i-need-help-on-making-my-content-go-viral-and-converting-to-sales-2;lora-nsfw
