Key,Category,Pain,Solution Hint,Mentions,Total Likes,Example Post IDs
shadow-ban-concerns,platform,User is worried about potentially being shadow banned and seeks advice on how to avoid it.,Engage with community members who have experience with shadow bans for insights.,1,3,is-this-shadow-ban
free-ai-photo-generation,tooling,User is looking for free alternatives to generate couple photos.,Check for community recommendations on free AI photo generation tools.,1,3,pykaso-alternative-2
fanvue-promotion-questions,monetization,User is uncertain about the effectiveness and risks of having Fanvue promote their Instagram profile.,Research the potential benefits and drawbacks of paid promotions.,1,3,get-fanvue-to-promote-instagram-profile
mass-dm-creation,platform,User is looking for ways to create mass DMs for Instagram without targeting their own followers.,Explore tools or services that specialize in mass messaging.,1,3,mass-dms-2
scam-suspicions,monetization,User is suspicious about the legitimacy of a business opportunity and seeks proof before investing time and money.,Look for reviews or testimonials from other users to validate the opportunity.,1,3,is-this-a-scam
skin-tone-consistency,tooling,User is facing issues with inconsistent skin tones in their AI-generated images.,Adjust the color settings in your image generation tool to ensure consistency.,1,3,need-advice
fanvue-offer-issues,monetization,User has not received promised likes and blue tick from Fanvue after signing up.,Contact Fanvue support for clarification on the offer.,1,3,fanvue-likes-and-blue-tick
monetization-without-phone,monetization,User is looking for ways to monetize without having to be on the phone.,Explore online monetization strategies that do not require direct communication.,1,3,help-33f54cec
outfit-swap-issues,tooling,User is looking for ways to swap outfits in images without triggering sensitivity flags.,Experiment with different styles and settings to avoid sensitivity issues.,1,3,outfit-swap
client-chat-strategy,monetization,User is unsure about the best approach to engage clients and encourage purchases.,Develop a strategy that includes both free and paid content to maintain interest.,1,3,strategy
warm-up-strategy-failure,results,User followed a warm-up strategy but received very low engagement on their content.,Reassess the warm-up strategy and consider alternative methods.,1,3,current-warm-up-does-not-work
posting-schedule-uncertainty,workflow,User is looking for a good posting schedule for Instagram and Threads.,Research best practices or consult experienced users.,1,3,posting-schedule
content-type-selection-uncertainty,platform,User is unsure about the content type to select during Fanvue sign-up.,Consult community guidelines or examples.,1,3,fanvue-sign-up
algorithm-suspicion-issue,platform,User is concerned that using Instagram on PC after creating an account on mobile may affect their account's algorithm.,Stick to one device for account management.,1,3,algorithm-question
content-restriction-uncertainty,platform,User is unsure if they can post faceswapped images on Fanvue.,Review Fanvue's content policies.,1,3,can-you-post-faceswapp-on-fanvue
discount-usage-issue,monetization,User is having trouble using a discount code for Pykaso.,Contact support for assistance.,1,3,pykaso-discount
content-sharing-uncertainty,monetization,User is unsure how to send photos for subscribers to purchase on Fanvue.,Consult Fanvue's help resources for guidance.,1,3,created-fanvue
boosting-restriction-issue,platform,User's boosting privileges on Instagram were restricted after adding a credit card.,Contact Instagram support for clarification.,1,3,instagram-boosting-restricted-be-careful
video-creation-error,tooling,User is encountering an error every time they try to create a video.,Seek assistance from experienced users or support.,1,3,expert-help
copyright-issues-with-faceswap,platform,I'm concerned about copyright issues when posting faceswapped photos.,Consult copyright guidelines or seek legal advice.,1,3,faceswap-0a682a0a
multiple-accounts-usage,platform,I'm unsure if it's okay to have two Instagram accounts on one phone.,Research Instagram's policies on multiple accounts.,1,3,is-it-ok-to-have-2-instagram-accounts-in-1-phone
mass-dm-tools,tooling,I need to know what program to use for mass DMs and how to get the DM list.,Seek recommendations for mass DM tools from the community.,1,3,mass-dms
face-swap-difficulties,tooling,I'm having trouble doing the face swap for my model.,Seek tutorials or community support for face swapping techniques.,1,3,first-attempt-2
account-creation-clarity,platform,I'm unsure if I need a new phone and SIM for a new Instagram account.,Research Instagram's policies on account creation.,1,3,insta-algorithm
verification-safety-concerns,platform,I'm concerned about using my personal documents for verification.,Consult privacy policies and community experiences.,1,3,is-it-safe-to-use-my-personal-documents-for-the-verification-even-though-i-set-the-acct-as-an-ai-influencer
cloning-issues,results,User's AI model training results in clones of the reference model instead of the desired character.,Review training data and adjust reference images.,1,3,help-with-generator
withdrawal-clarity,monetization,User is unclear about the requirements for withdrawing money from Fanvue.,Research withdrawal policies or seek advice from experienced users.,1,3,withdraw
traction-issues,results,User is not gaining traction on their IG reels despite posting multiple times.,Analyze content strategy and engagement tactics.,1,3,help-with-ig-reels
access-to-training,tooling,User is seeking access to more advanced training resources.,Reach out to community leaders for guidance on accessing advanced training.,1,3,advanced-training
need-tools-suggestions,tooling,User is looking for tools to enhance their AI influencer's capabilities.,Research popular AI tools or communities for recommendations.,1,3,so-this-my-new-ai-influencer-italia-sue
video-content-clarity,results,"User is uncertain whether videos can be sold on Fanvue, only allowing pictures.",Check Fanvue's content guidelines for clarity.,1,3,videos-on-fanvue
nsfw-content-generation-issue,results,User's AI model fails to generate NSFW content due to potential training issues.,Ensure the AI model is trained with appropriate datasets.,1,3,nsfw-8e4b7da9
workflow-consistency-issues,workflow,User is struggling with consistency in their workflow for generating AI content.,Consider streamlining the workflow or seeking feedback.,1,3,what-do-you-guys-think-3
promotion-strategy-issues,monetization,User is unsure how to promote their AI content on TikTok without mentioning AI.,Research TikTok marketing strategies.,1,3,tiktok-help
image-generation-capacity,tooling,User is looking for alternatives to generate a larger number of images.,Explore batch processing tools or services.,1,3,free-alternative-to-make-multiple-images
content-availability-issue,platform,User is struggling to find NSFW videos after the shutdown of shutterswap.,Look for alternative NSFW content platforms.,1,3,nsfw-videos-3e494cf9
withdrawal-safety-concerns,monetization,User is unsure about safely withdrawing money from Fanvue.,Consult Fanvue's guidelines for withdrawal safety.,1,3,i-have-an-important-question
face-consistency-issues,results,User is experiencing differences in face appearance between Pykaso and SDXL.,Adjust training methods to maintain face consistency.,1,3,face-on-pykaso-vs-sdxl
subscription-differences,monetization,User is confused about the differences between various subscriptions on Kling.,Provide a clear comparison of subscription tiers.,1,3,kling-3
country-restrictions,platform,User cannot use Fanvue due to country restrictions.,Look for alternative platforms that are accessible.,1,3,fanvue-doesnt-support-my-country
training-steps-issues,workflow,User is unable to select more training steps and doesn't understand their meaning.,Provide a guide on how training steps work.,1,3,training-steps
limitations-of-free-versions,tooling,User finds it impossible to create content using only free versions of programs.,Discuss the benefits of investing in paid versions.,1,3,free-app-versions
disclosure-questions,workflow,User is unsure about the necessity of disclosing AI identity on Instagram.,Provide guidelines on disclosure practices.,1,3,is-it-mandatory-to-disclose-an-ai-identity-on-instagram
subscription-pricing-questions,monetization,User is uncertain about how to set their subscription pricing on Fanvue.,Share strategies for pricing subscriptions.,1,3,fanvue-subscription-pricing
video-quality-comparison,results,User is unsure if Pykaso is as good as Kling for video creation.,Provide a comparison of video quality between the two platforms.,1,3,video-making-pykaso-or-kling
nsfw-content-issues,results,User finds Pykaso isn't generating good NSFW content.,Suggest alternative platforms for NSFW content generation.,1,3,pykaso-48893b1a
body-consistency-issues,results,User can recreate faces but struggles with consistent body generation.,Share techniques for achieving body consistency.,1,3,consistent-body
second-person-issue,workflow,Trying to get a second person on Fanvue but it's not letting me.,Check account settings or reach out to support.,1,3,trying-to-have-a-seccond-person
following-issue,platform,Receiving a message about pending requests when trying to follow people on IG.,Consider reaching out to IG support for clarification.,1,3,following-problems-on-ig
country-residence-change,onboarding,Concern about being unable to change country of residence on Fanvue after account creation.,Contact Fanvue support for assistance.,1,3,question-on-fanvue-account
consistent-face-issue,results,Struggling to keep a consistent face in different photos.,Experiment with different lighting and angles.,1,3,need-some-advice-2
tongue-issue,results,Looking for advice on how to fix a specific issue with the introduction video.,Consider editing techniques or software.,1,3,introduction-video
content-verification-issue,monetization,Account appears to be deleted or deactivated after receiving a verification email.,Reach out to Fanvue support for clarification.,1,3,need-to-know
generation-error,tooling,Experiencing an issue with generation.,Provide more details for troubleshooting.,1,3,generation-issue
account-flagged,platform,"Instagram account got flagged, causing issues with creating a new Gmail.",Consider using a different phone number or contacting support.,1,3,failure-and-success
subscriber-renewal-issue,monetization,Struggling to persuade subscribers to renew after free trial.,Offer exclusive content or discounts.,1,3,fanvue-subs
face-swap-clarity,tooling,Confusion about the differences between face swap features and their effectiveness.,Experiment with different methods to see which yields better results.,1,3,newcomer-with-quick-question
bikini-generation-issue,tooling,Unable to generate images of AI avatars in specific bikini styles.,Explore different AI tools that allow for such customization.,1,3,where-to-generate
fanvue-traffic-issue,monetization,Struggling to convert social media interactions into Fanvue subscribers.,Utilize targeted promotions or exclusive offers.,1,3,grow-on-fanvue
likes-boost-issue,monetization,The user has not received the promised 2k likes boost and is unable to contact support.,Consider reaching out to other users for advice on resolving support issues.,1,3,2000-likes-boost
shadow-ban,platform,The user suspects they have been shadow banned as their posts are not loading and their account is not discoverable.,Wait for a response from Instagram support before taking drastic actions like deleting the account.,1,3,instagram-possible-shadow-ban
referral-code-issue,tooling,The user is facing an issue with a referral code being invalid.,Check for updated referral codes or contact support for clarification.,1,3,fanvue-code-error-2
conversion-strategy,monetization,The user is unsure whether to engage with their few subscribers using chat scripts.,"Consider engaging with them to build rapport, even with limited content.",1,3,subscribers-and-followe-dms
nsfw-content-advice,prompts,The user is looking for suggestions on how to work on NSFW content.,Seek community tips on NSFW content creation.,1,3,what-do-you-think-f0f90d49
ai-tag-issue,platform,The user is unsure if Instagram automatically tags AI content or if it needs to be done manually.,Experiment with both methods to see which yields better engagement.,1,3,insta-post-question
video-editing-issue,tooling,The user wants to face swap a video made by Veo 3 but is unsure how to do it.,Look for video editing tools that support face swapping.,1,3,veo-3-issue
content-strategy,monetization,The user is unsure about the best approach for posting SFW vs NSFW content.,Consider audience preferences and engagement metrics when deciding.,1,3,sfw-vs-nsfw-on-fanvue-need-advice
boost-issue,monetization,The user did not receive a boost after signing up and is unsure if they did something wrong.,Contact support for clarification on the boost process.,1,3,fanvue-boost-2
monetization-issue,monetization,The user is struggling to monetize their content effectively as subscribers expect free content.,Clarify the value of your paid content to potential subscribers.,1,3,monetising-2
pricing-issue,monetization,The user cannot find the option to set a price before sending a photo.,Consult the platform's help section for pricing options.,1,3,help-for-set-the-price
subscriber-acquisition,monetization,The user is looking for the best way to acquire subscribers.,Engage with your audience through consistent content and promotions.,1,3,subs-2
account-issue,platform,The user is facing issues with their Instagram account being banned after verification.,Review Instagram's guidelines to avoid future bans.,1,3,ig-53065bae
profile-visibility-issue,platform,The user cannot find their newly created Instagram profile and is encountering posting errors.,Check for any account restrictions or shadow ban notifications.,1,3,issues-with-instagram-profile
image-editing-issue,tooling,The user wants to remove tattoos and necklaces from images but is unsure how to do it.,Look for image editing software that allows for easy modifications.,1,3,just-starting-on-this
engagement-issue,monetization,The user is receiving messages on Instagram but loses potential subscribers when sending links.,Consider alternative ways to engage without immediately sending links.,1,3,monetising
verification-concerns,platform,The user is worried about video verification due to the AI model not resembling them.,Consult community members who have faced similar situations.,1,3,best-way-to-proceed
deformities-issue,results,The user is looking for solutions to stop deformities in their AI-generated images.,Seek advice on specific techniques to minimize deformities.,1,3,deformities
link-posting-strategy,platform,The user is unsure when and how to post links on social media without getting banned.,Research best practices for link sharing on each platform.,1,3,posting-links-on-igthreadstiktok
content-preparation,workflow,The user is unsure about what content to prepare before creating their Instagram profile.,Consider preparing a mix of content types to engage different audiences.,1,3,content-2
model-proportions-issue,results,"The user is facing issues with body proportions in their AI model, making images unusable.",Consider using negative prompts or additional training images.,1,3,i-need-suggestion-to-perfect-ai-model
link-availability-issue,platform,Difficulty finding the link to the live call despite being at level 3.,Suggest clearer communication from organizers regarding link distribution.,1,3,no-link-to-live-call
realism-issue,tooling,Generated NSFW content appears too fake.,Experiment with different models or settings for realism.,1,3,i-need-some-help-with-it
client-acquisition-difficulty,workflow,The user finds client acquisition very difficult and is unsure whether to focus on social media or content creation.,"Consider a balanced approach, combining social media engagement with content creation.",1,3,im-stuck
client-attraction-strategy,monetization,The user is unsure about strategies to attract clients to their Fanvue.,Consider using targeted marketing strategies to reach potential clients.,1,3,clientele
nsfw-settings-limitation,tooling,The user is limited to only one setting in their Pykaso for NSFW content creation.,Explore alternative tools or settings that allow for more flexibility.,1,3,need-help-making-nsfw
platform-communication-concerns,platform,The user is unsure about the rules of contacting clients on other platforms.,Review platform guidelines regarding cross-platform communication.,1,3,how-do-i-play-this
negative-prompting-issues,tooling,The user is struggling with writing negative prompts for better image generation.,Experiment with different prompt structures to improve results.,1,3,1-good-image-so-far
training-settings-unclear,training,Uncertainty about the best settings to use for training the LORA model.,Seek advice from experienced users or documentation.,1,3,help-training-lora
image-generation-variability,results,Repeated attempts to generate a specific NSFW image result in weird outputs.,Adjust prompts or settings for better results.,1,3,nsfw-help
view-count-concern,results,"Low view counts despite following warm-up instructions, raising shadowban concerns.",Review account activity and engagement strategies.,1,3,shadowbanned
verification-challenge,onboarding,Difficulty bypassing the 18+ verification process on Fanvue.,Seek advice on legitimate verification methods.,1,3,18-verification
client-discovery-issue,monetization,Lack of a discovery page on Fanvue makes it hard for clients to find accounts.,Utilize social media links to drive traffic.,1,3,how-can-clients-discover-you-on-fanvue
generation-issue,results,Pykaso generates the same model repeatedly despite prompt changes.,Try varying prompts more significantly.,1,3,pykaso-problem
inconsistent-output,results,The AI model does not maintain a consistent appearance across outputs.,Adjust training data and parameters for consistency.,1,3,ai-model-is-not-consistent
nsfw-generation-issue,results,Difficulty generating quality NSFW content and prompts.,Experiment with different prompts and techniques.,1,3,nsfw-content-756cb524
deformation-issues,results,Experiencing deformed feet and hands in generated images.,Try adjusting the prompts or using reference images for better results.,1,3,feet-and-hands-issues
ad-effectiveness-issues,monetization,Uncertainty about the effectiveness of paid ads for boosting content.,Test small ad campaigns to gauge effectiveness before scaling.,1,3,boosting-insta
subscriber-issues,results,Concerns about receiving a fake first subscriber on Fanvue.,Monitor subscriber activity for authenticity.,1,3,does-fanvue-give-you-a-fake-first-sub
transparency-issues,workflow,Uncertainty about whether to disclose AI identity while interacting.,Consider the potential impact on subscriber trust and engagement.,1,3,do-you-say-you-are-ai-when-you-talk-or-not
color-generation-issues,results,Hair color keeps generating as blonde instead of the desired silver-lilac.,Adjust training images to better reflect the desired hair color.,1,3,i-cant-change-the-hair-colour-what-would-you-do-instead
content-strategy-concerns,monetization,User is unsure how to differentiate content between Instagram and Fanvue without upsetting followers.,Develop a unique content strategy for each platform.,1,3,post-strategy
platform-choice-uncertainty,platform,User is unsure whether to use Reveal.link or Fanvue for content sharing.,Evaluate the benefits of each platform.,1,3,reveallink
verification-status-uncertainty,platform,User is unsure about the status of their Fanvue verification.,Check the dashboard for verification updates.,1,3,fanvue-question
link-sharing-strategy,monetization,User is unsure about the best way to share their IG link in their TikTok profile.,Consider various sharing methods to maximize visibility.,1,3,tiktok-2
dm-engagement-issues,monetization,"User is receiving vulgar DMs from non-US users, causing discomfort.",Consider adjusting privacy settings or reporting abusive messages.,1,3,confused-2
resource-access-issues,tooling,User is unable to access legal videos from Shutterswap as mentioned in tutorials.,Seek alternative resources for legal video content.,1,3,shutterswap
image-variability,results,"Roughly half of my images are messed up, and I'm unsure what percentage of image generations can be expected to be usable.",Seek advice on improving image generation consistency.,1,3,first-picture-of-my-model
missing-model-option,tooling,"My Pykaso does not have the SDXL - PPV option, limiting my ability to use certain features.",Seek help on how to access or enable the missing model option.,1,3,feedback-4bab2caa
face-generation-challenges,results,"I'm struggling to create images without the character's face when using a seed, which is frustrating.",Seek advice on generating images with specific requirements.,1,3,no-face-issue
mirror-selfie-issues,results,I can't generate mirror selfies correctly; it always duplicates the character.,Request help on how to prompt for mirror selfies.,1,3,need-help-asap
search-for-free-alternatives,tooling,I'm looking for a free alternative to Pykaso for AI image generation without watermarks.,Request recommendations for free tools.,1,3,need-your-brainpower
strategy-confusion,workflow,"I saw a new video suggesting changes to the warm-up strategy, and I'm unsure if I should start over.",Request clarification on the updated warm-up strategy.,1,3,new-warm-up-strategy
link-in-bio-issues,platform,I'm confused about the differences between using getallmylinks and linktree for my bio.,Ask for recommendations on the best link setup.,1,3,link-in-bio-possible-problems-for-all-users
photos-distorted,results,The user is experiencing distorted and strange outputs from their photo generation attempts.,Try adjusting the prompts or using different settings in the AI tool.,1,3,photos-distorted-strange-tried-various-prompts-need-help-anything-i-can-change-or-do-different
morphed-images,results,The user is getting morphed images despite using the same AI model.,Experiment with different training data or settings to improve output consistency.,1,3,any-advice
missing-sdxl-ppv,tooling,The user only has access to Flux and not the SDXL PPV tool.,Request information on how to gain access to the SDXL PPV tool.,1,3,missing-tool
character-consistency-issue,results,The user cannot maintain the same character when using the SDXL PPV tool.,Explore methods to ensure character consistency across different tools.,1,3,using-sdxppv
service-outage,platform,The user is experiencing a 404 error when trying to access Pykaso tools.,Check for service status updates or community reports on outages.,1,3,is-pykaso-down-or-is-it-just-me
account-flagging,platform,The user is unsure whether to maintain an account flagged for review.,Consider reaching out to support for clarification on account status.,1,3,ig-account-flag-for-review-before-you-follow
platform-ban,platform,The user has been banned from Fanvue and is seeking alternatives.,Research other subscription-based platforms for content sharing.,1,3,fanvue-bannned-me
lack-of-manual,tooling,"The community lacks a comprehensive manual for content creation, making it frustrating for newcomers.",Create a shared resource or guide for new users.,1,3,from-zero-to-hero-consistent-faces-on-sdxl-real-solutions-part-3
legal-issues,monetization,"Creators risk account bans and legal trouble if their AI models appear underage, regardless of stated age.",Ensure models are designed to avoid any appearance of being underage.,1,3,alert-for-ai-girl-creators
character-development-uncertainty,feedback,User is unsure about the personality traits to assign to their AI model.,Seek community input on character development.,1,3,thoughts-on-my-model-lia
course-content-issues,tooling,User reports a missing video in the course material.,Notify course administrators to fix the issue.,1,3,missing-video-in-course
account-health-check,platform,User reminds others to check their Instagram account status to avoid low views.,Regularly monitor account status for any flags or issues.,1,3,instagram-account-status
financial-pressure,monetization,User feels pressured to make money this month or consider leaving the community.,Seek support and strategies from the community to improve sales.,1,3,last-chance
outdated-strategies,results,Users are finding that strategies that were effective a few months ago are no longer yielding results.,Stay updated with current trends and adapt strategies accordingly.,1,3,what-worked-3-months-ago-is-outdated
platform-performance,results,"Users are experiencing poor performance on Instagram despite consistent posting, leading to disappointment.",Analyze engagement metrics and adjust content strategy for better results.,1,3,failed-on-ig-but-thread-looks
landing-page-creation-issues,tooling,User is having problems creating a 'getallmylinks' landing page.,Provide troubleshooting steps for landing page creation.,1,3,getallmylinks-2
no-views-on-reel,results,User's first reel received no views despite efforts.,Suggest strategies for increasing reel visibility.,1,3,first-reel-0-views
account-setup-clarity,onboarding,User is unsure about the correct prompt selection when creating an Uncove account.,Clarify account setup instructions.,1,3,uncove-e60523b8
account-flagging-issues,platform,User's account has been flagged and is seeking advice on how to resolve it.,Provide steps to address account flagging.,1,3,account-flagged
faceswap-clarity,tooling,User is unsure if faceswap includes hair color and how to prompt for it.,Clarify faceswap functionalities.,1,3,faceswap-help
