Key,Category,Pain,Solution Hint,Mentions,Total Likes,Example Post IDs
reveal-photo-issue,platform,"The reveal photo link is not working, leading to frustration.",Check the link format or consult support for troubleshooting.,1,2,reveal-not-showing
content-issues,platform,Experiencing issues with Instagram content not being fully revealed.,Review content guidelines to ensure compliance.,1,2,insta-2
content-theft,platform,"A user is stealing content and posting it as their own, causing frustration among creators.",Report the user and encourage community vigilance.,1,2,thief-fabian-flores
like-receipt-issues,monetization,Users are not receiving likes on their Fanvue posts despite signing up.,Check the platform's support for troubleshooting.,1,2,fanvue-likes-2
bundle-setup-uncertainty,workflow,Uncertainty about how to set up bundles on Fanvue.,Seek guidance from experienced users or support.,1,2,help-655e1f8e
low-follower-count,monetization,"Struggling to gain followers on Instagram, stuck at a low count.",Engage with niche communities and use targeted hashtags.,1,2,how-to-get-people-on-instagram-etc
visibility-concerns,platform,Uncertainty about whether a US phone SIM is necessary for visibility on social media.,Test engagement strategies without a SIM and evaluate results.,1,2,us-phone-sim-necessary
audio-quality-issues,results,"Concerns about the quality of audio in videos, affecting believability.",Experiment with different audio editing techniques.,1,2,audio-and-voice-in-videos
content-setup-issues,monetization,Uncertainty about how to structure content on Fanvue for maximum engagement.,Seek examples from successful creators.,1,2,fanvue-content
dm-management-issues,workflow,Uncertainty about how to manage a large volume of DMs.,Develop a strategy for prioritizing and responding to messages.,1,2,what-to-do-wdms
face-swap-consistency-issues,results,Difficulty achieving consistent results with face swaps.,Experiment with different training techniques.,1,2,repaired-model
content-preparation-issues,monetization,Uncertainty about how much content is needed before launching on Fanvue.,Gather insights from successful creators on content preparation.,1,2,content-needed-to-launch
geographic-reach-issues,monetization,Concerns about reaching audiences in different countries from Portugal.,Utilize targeted marketing strategies to expand reach.,1,2,organic-content-location
option-availability-issues,tooling,"The SDXL option is not appearing, causing frustration.",Check settings and reach out for support if needed.,1,2,sdxl-ppv-efbc9377
tinder-verification,platform,User is facing issues with biometric verification on Tinder for their AI model account.,Seek advice on how to improve the quality of the model's images to meet Tinder's requirements.,1,2,urgent
steps-maximum,tooling,User is uncertain about the maximum number of steps they should take in a process.,Consult documentation or community guidelines for best practices.,1,2,can-someone-answer-fast
content-viral-sales,monetization,User is struggling to make their content go viral and convert to sales.,Consider utilizing social media marketing strategies to increase visibility.,1,2,i-need-help-on-making-my-content-go-viral-and-converting-to-sales
attracting-customers,monetization,User is not getting new customers despite some initial success.,Consider marketing strategies to attract new customers.,1,2,day-5-update
low-instagram-engagement,platform,User is experiencing low views on their Instagram reel despite warming up their account.,Engage with followers and use relevant hashtags to increase visibility.,1,2,instagram-warm-up-2
low-reel-views,platform,User is not receiving views on their Instagram reels and seeks advice.,Engage with your audience and consider using trending sounds or hashtags.,1,2,advice-for-ig
consistent-image-generation,tooling,User is looking for ways to generate consistent images from their AI tool.,Experiment with different settings and prompts to achieve consistency.,1,2,ai-influencer-day-4
faceswap-results,tooling,User is not satisfied with the results from Pykaso's face swap feature.,Consider trying different images or settings for better results.,1,2,faceswap-b705e811
error-understanding,tooling,User is confused about an error encountered while generating images.,Seek help from the community to clarify the error message.,1,2,i-cannot-understand-the-error
platform-choice,monetization,User is unsure about which platform to choose for monetizing their model.,Research both platforms to compare features and user experiences.,1,2,fanplace-or-uncove
ig-promo-success,monetization,User is looking for successful IG promo strategies to boost follower engagement.,Seek recommendations for effective promo providers.,1,2,ig-promos
sdxl-not-available,tooling,"User is unable to find the SDXL option in the Pykaso AI Image Generator, which is crucial for their project.",Check for updates or reinstall the tool.,1,2,hey-everyone-a5643a94
us-sim-requirement,platform,User is confused about the necessity of a US SIM to create a US account on Instagram.,Research alternative methods to verify location.,1,2,us-sim-or-how-to-attract-us-customers-outside-the-us
subscription-pricing-uncertainty,monetization,User is unsure about the best pricing strategy for subscriptions and photo sales on OnlyFans.,Consult market research or competitor pricing.,1,2,help-please-2d46e1bd
piercing-removal-uncertainty,workflow,User is uncertain about whether to remove a nose piercing and how to correct it using Pykaso.,Seek advice from experienced users or tutorials.,1,2,need-help-b82e1a25
model-anomalies,results,"User is encountering many anomalies in generated models, such as twisted hands and legs.",Review training data for quality and relevance.,1,2,ai-training-3
prompt-creation-uncertainty,prompts,User is looking for tips on creating effective prompts for AI training.,Explore community resources or examples of successful prompts.,1,2,tips-for-prompts
monetization-frustration,monetization,User feels stuck and dejected about not making money after several months in the AI OFM space.,Seek mentorship or review marketing strategies.,1,2,need-help-stuck-trying-to-go-viral-and-convert-content-into-sales
credit-cost-uncertainty,monetization,User is confused about the cost of generating images on Civitai.com and the credit system.,Clarify pricing structure on the platform.,1,2,question-on-civitaicom
nsfw-video-creation-uncertainty,workflow,User is looking for the best way to create NSFW videos from images.,Research tools specifically designed for NSFW content.,1,2,image-to-video
content-access-issues,tooling,User is looking for alternatives to obtain spicy videos now that Shutterswap is down.,Ask the community for recommendations.,1,2,alternatives
sdxl-visibility-issue,tooling,User is not seeing the SDXL PPV model option when creating.,Check for updates or reinstall the software.,1,2,sdxl-model-not-showing
training-settings-issue,tooling,User cannot change the settings of their trained AI after maximizing steps.,Consult the tool's documentation for troubleshooting.,1,2,setting-of-trained-influencer
decreasing-views,results,"Every time I post a new reel, it gets less views each time.",Consider analyzing your content strategy or engagement tactics.,1,2,guys-is-this-normal-help
budgeting-for-content,monetization,I'm worried about my spending on Pykaso without making any money yet.,Evaluate your content monetization strategy and expenses.,1,2,avg-montly-budget
editing-issues-in-pykaso,tooling,I can't edit an existing photo in Pykaso; it won't let me.,Check for file compatibility or seek alternative editing tools.,1,2,edit-a-photo-in-pykaso
video-generation-errors,tooling,"I'm getting an error when trying to generate videos in Pykaso, stating the content is too sensitive.",Adjust your content settings or contact support for troubleshooting.,1,2,video-generating-problem-pykaso
ai-image-editor-issues,tooling,"I'm having problems with the AI image editor, like changing the background.",Look for alternative editing tools or community tips.,1,2,ai-image-editor-2
model-training-questions,tooling,I'm unsure if using multiple pictures of different models for training is a good idea.,Consult community best practices for model training.,1,2,ai-model-ea3a52b4
model-development-questions,tooling,I need guidance on how to base my AI model off a specific reference.,Look for tutorials on model development and reference usage.,1,2,update-4
posting-schedule-clarity,workflow,I'm unclear about when to post reels during the daily challenge.,Consult community guidelines or best practices for posting.,1,2,question-reels
content-guidelines,platform,I'm confused about whether to post nudes or only sexy photos on Fanvue.,Research platform content guidelines for clarity.,1,2,need-help-bbb08242
update-clarity,tooling,I'm confused if Pykaso has had an update that affects my usage.,Check for update logs or community discussions.,1,2,did-pykaso-ai-got-some-type-of-update
link-website-clarity,platform,I'm unsure which link website to use for my needs.,Research and compare features of popular link services.,1,2,help-please-14623996
scheduling-tools-concerns,workflow,I'm curious if using scheduling tools affects reach or flags my account.,Consult community experiences with scheduling tools.,1,2,using-social-media-scheduling-tools
posting-frequency-questions,workflow,I'm unsure how many reels to post daily for my new Instagram account.,Research best practices for posting frequency.,1,2,instagram-account
content-guidance-issues,results,I'm unsure about the content guidelines for my AI model.,Research platform content guidelines for clarity.,1,2,modell
ai-video-creation-issues,results,I need help making AI OFM videos that look realistic.,Seek tutorials or community support for video creation.,1,2,anyone-know-how-to-make-ai-ofm-videos
platform-recommendation,tooling,User is seeking recommendations for video face swapping platforms.,Research popular tools and user reviews.,1,2,face-swap-e0e0fa9c
growth-strategy-issues,monetization,User is seeking advice on how to grow their Instagram account.,Engage with the community and utilize effective marketing strategies.,1,2,how-to-grow-the-instagram
training-guidance-issues,tooling,User needs guidance on retraining their AI model to avoid previous mistakes.,Consult community resources for training best practices.,1,2,retrain-ai
threads-warm-up-clarity,workflow,User is unclear about the process for warming up Threads.,Seek clarification from community members.,1,2,a-little-help
training-image-requirements,tooling,User is unsure about the types of images needed for training their AI model.,Consult training guidelines for best practices.,1,2,training-2
anonymity-concerns,workflow,User is concerned about maintaining anonymity while promoting their AI model.,Provide tips on separating personal and business accounts.,1,2,question-c935aaf6
nsfw-content-questions,results,User is unsure about the best app for NSFW videos.,Compile a list of recommended apps for NSFW content.,1,2,question-bc4593a4
platform-shutdown-issues,platform,User is looking for alternatives since Shutterswap is shutting down.,Compile a list of alternative platforms.,1,2,shutterswap-3
program-clarity-issues,monetization,User is unsure about the details of the Fanvue 5k program.,Clarify the terms and conditions of the program.,1,2,fanvue-5k-program
model-access-issues,platform,User only has access to one model option in Pykaso.,Provide troubleshooting steps for accessing other models.,1,2,only-flux-option-in-pykaso
shutterswap-issue,tooling,Shutterswap is not working.,Check for updates or alternative tools.,1,2,shutterswap-no-work
realistic-ai-creation,tooling,Difficulty in creating realistic AI pictures and videos.,Seek recommendations for the best software or tools.,1,2,people-i-need-your-help-lol
model-training-issue,results,Confusion about the effectiveness of training an AI model with mismatched reference images.,Use consistent reference images for better results.,1,2,am-i-on-the-right-track
prompt-specificity,prompts,"The AI influencer is not performing well, and the user is unsure if they should write a more specific prompt.",Consider refining your prompts to be more detailed.,1,2,first-ai
image-errors,results,"The user is facing issues with image errors, specifically with hands and legs, which affects the upscaling process.",Explore image editing tools to correct specific body parts.,1,2,first-ai
model-consistency,results,The user is struggling to generate a specific model consistently using Stable Diffusion.,Look for extensions that enhance model consistency.,1,2,any-tips-for-consistency-using-stable-diffusion
account-creation-issue,platform,The user is unable to create an account on Fanvue due to regional restrictions.,Seek assistance from community members who can help with account creation.,1,2,cant-create-an-account-on-fanvue
shadow-ban-uncertainty,platform,The user is unsure if they are shadow banned due to low views on their reels.,Continue posting and engaging to see if visibility improves.,1,2,ig-shadowban-or-not
phone-number-requirement,platform,The user is being asked to add a phone number to their Instagram account but prefers not to.,Look for ways to bypass this requirement or contact support.,1,2,my-instagram-account
account-creation-help,platform,The user is looking for assistance in creating a Fanvue account due to regional restrictions.,Reach out to community members who can assist with account creation.,1,2,fanvue-da136164
shadow-ban-check,platform,The user needs help checking if they are shadow banned on Instagram.,Ask community members for advice on identifying shadow bans.,1,2,can-someone-help-me
follower-growth-concern,results,The user is worried about low follower growth after one week of warming up.,Consider adjusting your content strategy to attract more followers.,1,2,how-much-followers-you-have-after-1-week-warmup
photo-creation-struggle,workflow,Struggling to create more photos of the same AI character.,Consider using consistent prompts and training methods.,1,2,who-can-help-me-2
content-creation-struggle,workflow,Struggling to create enough images for character development.,Focus on refining the training set for better results.,1,2,who-can-help-me
video-quality-concern,results,Uncertainty about the quality of a video due to potential deformations.,Seek feedback from peers to identify specific issues.,1,2,feedback-please-31085ee0
low-view-concern,results,"First reel received less than 20 views, raising concerns.",Consider promoting the reel through other channels.,1,2,reels-9fd75685
link-access-issue,platform,Uncertainty about where to find the link for live coaching.,Consult the community or official channels for guidance.,1,2,live-coaching-link
prompt-examples-request,workflow,Seeking prompt examples for creating realistic AI nude photos and videos.,Engage with the community for shared tips and successful prompts.,1,2,need-help-718ebf3f
budget-clarity-issue,monetization,Uncertainty about the estimated budget required to run an AI model.,Research typical costs associated with AI model subscriptions and tools.,1,2,upfront-cost
face-consistency-issue,tooling,Inconsistent facial features when generating nude images.,Use consistent prompts and training data for better results.,1,2,consistent-face-and-nudes
content-disclosure-concern,monetization,Uncertainty about disclosing AI-generated content to subscribers.,Review platform policies on content disclosure.,1,2,should-i-mention-its-ai
missing-ppv-option,platform,The user is confused about the absence of the SDLX PPV model option.,Check account settings or contact support for clarification.,1,2,help-9be62387
roleplay-anxiety,workflow,The user feels anxious about not knowing how to engage in roleplay during a conversation.,Practice roleplay scenarios or seek guidance from experienced chatters.,1,2,i-screwed-up
unexpected-client-requests,workflow,The user is caught off guard by unexpected requests from subscribers.,Prepare a list of responses for common unexpected requests.,1,2,i-wasnt-ready-for-this-lmaooo
body-consistency-training,tooling,The user is seeking suggestions on how to train for body consistency in their AI model.,Utilize consistent reference images for training.,1,2,body-consistency
client-conversion-struggles,monetization,The user is struggling to convince Instagram chatters to subscribe to their Fanvue.,Develop a clear value proposition for potential subscribers.,1,2,help-with-ig-chats
posting-restrictions,platform,The user is unsure about posting reels with music without a VPN.,Research platform policies regarding music usage.,1,2,reels-b706380b
programming-uncertainty,tooling,The user is unsure how to program SDXL for creating nude images of their AI character.,Seek resources or tutorials on programming SDXL for specific content types.,1,2,quetion
guide-relevance-issues,workflow,The user is confused about the relevance of the Instagram Chatting Guide for Fanvue.,Adapt the guide's strategies to suit the specific platform.,1,2,chatting-guide
geographic-restrictions,monetization,The user is concerned about needing a US SIM card to make money and gain subscribers.,Investigate platforms that accept international IDs.,1,2,give-yr-opinion
targeting-challenges,monetization,The user struggles to target potential clients who will spend money on their content.,Consider using targeted advertising to reach specific demographics.,1,2,kindly-help
image-generation-issue,results,"Images generated with Pykaso do not match the prompt, resulting in strange outputs.",Refine prompt details for better accuracy.,1,2,problem-generating-image-with-pykaso
account-creation-challenges,onboarding,Difficulty creating a creator account on Fanvue due to ID restrictions.,Seek advice on alternative verification methods.,1,2,creating-an-account-on-fanvue
spam-concerns,monetization,"Receiving repeated spam requests to buy panties, causing confusion.",Report spam and avoid engaging with suspicious accounts.,1,2,fanvue-offer-to-buy-your-panties-real-or-scam
prompt-sharing-request,workflow,Requesting prompts from others to achieve a specific model pose.,Share your own prompts to encourage collaboration.,1,2,need-help-65366f8f
suspicious-contact-issue,workflow,Receiving suspicious messages from potential buyers on Telegram.,Exercise caution and verify identities before engaging.,1,2,need-help-fa74dbf3
realism-feedback-request,feedback,Seeking feedback on the realism and consistency of generated photos.,Encourage honest critiques to improve quality.,1,2,need-some-input
view-discrepancy,results,Significant difference in views between accounts followed during warm-up.,Analyze engagement strategies for improvement.,1,2,i-followed-the-warm-up-ig-accounts-but
like-acquisition-strategy,monetization,Uncertainty on how to acquire 2000 likes on Fanvue.,Engage with the community and promote your content.,1,2,fanvue-likes
market-viability-concern,monetization,Concerns about the long-term viability of the business niche due to saturation.,Explore unique content strategies to stand out.,1,2,market-saturated
feature-issue,tooling,The music button is missing when creating reels in Instagram.,Check app settings or reinstall the app.,1,2,no-music-button-creating-reels-in-ig
training-process-clarity,training,Confusion about the training process for the model and face swapping.,Request a step-by-step guide from experienced users.,1,2,training-your-model
tool-restrictions,tooling,Pykaso does not allow the creation of explicit NSFW videos.,Consider using other software that supports NSFW content.,1,2,alternative-nsfw-generators
censorship-issues,results,"King AI is too censored, preventing the generation of desired nude content.",Explore less restrictive platforms for content creation.,1,2,nudes-2
feature-availability-issues,tooling,Missing music button for creating reels on Instagram.,Check for app updates or feature rollouts.,1,2,using-trading-music
subscriber-engagement-issues,monetization,Uncertainty about how to effectively communicate with subscribers to encourage payment.,Develop a strategy for engaging subscribers and offering value.,1,2,im-new-here-and-i-just-got-a-subscriber
platform-restriction-issues,monetization,"Stuck using Pykaso for NSFW videos, seeking alternatives.",Look for other platforms that allow for more flexible content creation.,1,2,make-my-first-earning
idea-generation-issues,workflow,Struggling to find ideas for posts and spending too many credits on generation.,Brainstorm ideas in advance and set a budget for credits.,1,2,struggling-to-prepare-posts
profile-update-issues,platform,User's profile on Fanvue has not changed despite reaching out for updates.,Follow up with support for profile changes.,1,2,fanvue-offer-no-change-on-profile
guide-following-issues,workflow,User is unable to click through the guide despite having the rights button enabled.,Review guide steps or seek assistance.,1,2,need-help-3cb893f6
nsfw-content-challenges,results,User anticipates challenges with the NSFW aspect of their generated model.,Seek community tips for NSFW content creation.,1,2,this-is-the-girl-i-generated
kyc-verification-issues,platform,User is having repeated issues with KYC verification using their driving license.,Contact support for KYC assistance.,1,2,kyc-verification
platform-navigation-issues,tooling,User is confused about how to navigate SugarLabs AI and faces restrictions.,Request a tutorial or guidance from experienced users.,1,2,navigating-sugarlabs-ai
promotion-issues,monetization,User is hesitant to promote on NSFW subreddits due to photo verification requirements.,Evaluate the potential benefits of subreddit promotion.,1,2,reddit-2
intro-video-creation-issues,tooling,User is unsure how to create an intro video for their model.,Look for tutorials or community advice on video creation.,1,2,problem-facing-fanvue-intro-video
video-creation-questions,tooling,User is questioning the choice of video creation tools and methods.,Seek community feedback on preferred tools.,1,2,what-do-your-guys-think-of-videos-throught-pikaso
problem-solving-issues,workflow,User is seeking help to solve an unspecified problem.,Provide more details for targeted assistance.,1,2,facing-issues
customer-acquisition-issues,monetization,User is struggling to find clients despite efforts to engage them.,Reassess outreach strategies to attract customers.,1,2,i-need-help-with-instagram-customers
video-creation-tool-uncertainty,tooling,User is seeking recommendations for tools to create videos for Instagram reels.,Ask the community for tool suggestions.,1,2,day-1-5c10dae1
follower-engagement-issues,monetization,User is not receiving follow-backs during the Instagram warmup phase.,Review engagement tactics to improve follow-back rates.,1,2,help-with-insta
limited-pose-variability,results,"Every picture I create has my character standing, and I struggle to get decent results for specific poses.",Request advice on prompting for varied poses.,1,2,struggling-to-generate-non-standing-pics
account-warning,platform,I received a warning that my Instagram account might be automated despite following the warm-up strategy.,Inquire about changes in Instagram's policies or best practices.,1,2,need-help-with-instagram
inconsistent-nsfw-results,results,I'm having trouble maintaining consistency in NSFW content generation.,Seek strategies for achieving consistent results in NSFW content.,1,2,consistency-in-nsfw-content
premium-subscription-requirement,tooling,"I'm prompted to buy premium to create an AI girl, which I wasn't expecting.",Inquire about the necessity of a premium subscription.,1,2,my-first-ai-girl
video-introduction-issues,tooling,I'm unsure how to create an intro video for my model.,Ask for guidance on video creation techniques.,1,2,help-e79ff79a
content-posting-dilemma,monetization,I'm unsure whether to post nude content in the Fanvue feed or keep it behind a paywall.,Request opinions on content posting strategies.,1,2,should-i-post-nudity-in-fanvue-feeds
missing-sdxl-option,tooling,"The SDXL option is not showing in my Pykaso account, which is frustrating.",Ask for help in troubleshooting the missing option.,1,2,question-dc9b5b02
initial-feedback-request,feedback,I'm looking for feedback on my initial work as I'm just getting started.,Encourage community members to provide constructive feedback.,1,2,feedback-needed-getting-started
learning-curve,onboarding,"As a newbie, I'm eager to learn but feel overwhelmed.",Ask for beginner resources or tips.,1,2,newbie-4
slow-start,monetization,I've just started on Fanvue and need tips to encourage subscribers to start paying.,Request strategies for converting followers into paying subscribers.,1,2,just-started-on-fanvue
bank-account-uncertainty,monetization,The user is unsure if their current bank account is suitable for linking to Fanvue.,Consult with a financial advisor or seek community advice on account suitability.,1,2,billing-for-fanvue
missing-scripts,tooling,Users are unsure where to find scripts that were promised to help sell their content.,Request the scripts directly from the community or platform support.,1,2,fanvue-scripts
script-unlock-issues,tooling,User's advanced script did not get unlocked as expected.,Contact support for assistance with script access.,1,2,advanced-script
nsfw-content-tutorials,tooling,User is seeking tutorials for creating NSFW content but is unable to find them.,Request links to tutorials from the community.,1,2,feedback-9670571d
nsfw-creation-issues,tooling,"User is struggling to create nude content with Pykaso, finding it inefficient.",Seek alternative methods or tools for NSFW content creation.,1,2,nude-creation
leveling-challenges,workflow,Users find it difficult to level up to level 7 and are seeking strategies.,Share tips and strategies within the community.,1,2,leveling-up-to-level-7-seems-so-difficult
