Key,Category,Pain,Solution Hint,Mentions,Total Likes,Example Post IDs
hand-issues,tooling,User is frustrated with AI's inability to generate accurate hands.,Use inpainting to correct hand issues.,1,7,how-to-fix-hands
pricing-issues,monetization,User is unsure about pricing for content on Uncover.,Seek community advice on pricing strategies.,1,7,need-help-with-pricing-and-ppv-content-on-uncover
link-suspicion,platform,The user is unsure when to post a link in their bio without raising suspicion from Instagram.,Wait until you have a stable follower base before adding links.,1,7,posting-link-on-ig
subscriber-management,monetization,The user is unsure how to manage existing subscribers when changing models.,Communicate changes clearly to subscribers to maintain engagement.,1,7,uncovefanvue-existing-model
content-duplication,workflow,The user is uncertain about how to manage content across multiple Instagram accounts.,Consider creating unique content for each account to avoid redundancy.,1,7,managing-multiple-instagram-accounts-for-uncover
pricing-strategy,monetization,The user is seeking feedback on their pricing structure for content sales.,Research market rates and adjust pricing accordingly.,1,7,pricing-structure-feedback
bank-connection-issues,monetization,The user is facing errors when trying to connect their bank account to Uncove.,Contact support for assistance with bank account connections.,1,7,connecting-bank-account-to-uncove
auto-message-issues,tooling,The user is unable to save automatic messages in Uncover.,Report the bug to support for resolution.,1,7,uncover-auto-messages-bug
account-management,workflow,Difficulty in managing multiple models across several accounts.,Develop a systematic approach or tool for managing multiple accounts.,1,7,several-fanvue-or-uncover-accounts
pricing-consistency,monetization,Challenges in setting consistent prices for media on platforms as a new user.,Develop a pricing grid based on community feedback and market research.,1,7,request-for-a-media-pricing-grid-on-platforms
training-image-preparation,tooling,User finds preparing training images for Comfy UI time-consuming.,Look for automation tools to streamline the process.,1,6,for-you-who-want-to-train-a-lora-in-comfy-ui
underage-appearance-issue,platform,Concerns about looking underaged on Fanvue leading to account suspension.,Avoid certain clothing styles that may trigger guidelines.,1,6,be-careful-to-not-look-underaged-on-fanvue
question-clarity,workflow,Overwhelmed by the number of vague questions being asked in the community.,Encourage more specific questions with context.,1,6,help-me-4
platform-verification-issues,platform,"Users can no longer verify AI model accounts on Uncove, limiting their options.",Consider using alternative platforms like Fanvue.,1,6,problem-with-private-platform-verification
crypto-only,monetization,"Pykazo has switched to only accepting cryptocurrency, leaving users without crypto options feeling excluded.",Look for other tools that offer similar functionalities without crypto restrictions.,1,6,pykazo-is-only-cypto-now-need-new-option
faceswap-challenges,tooling,User is struggling to find enough images for faceswapping and is unsure about the process.,Provide guidance on sourcing images for faceswapping.,1,6,hello-b2640192
confusion-on-usage,onboarding,User is completely lost on how to use seduced.com after creating an account.,Provide a clear onboarding guide.,1,6,seducedcom-3
realism-feedback-needed,results,User is receiving feedback that their video looks AI-generated and is seeking tips for improvement.,Offer feedback on enhancing realism in videos.,1,6,can-i-get-some-feedback-on-my-girls-video
adult-content-creation,results,User is struggling to prepare their model for adult content despite receiving likes.,Provide guidance on transitioning to adult content.,1,6,some-advice-or-team-work
platform-clarity,onboarding,User is confused about whether to create an AI on Uncove or Fanvue.,Clarify platform functionalities.,1,6,hello-b1e7cb17
insights-interpretation-issues,results,User is unsure about the interpretation of their Instagram insights and performance.,Seek advice on analyzing insights for better strategy.,1,6,instagram-insights
client-tipping-issues,monetization,Struggling to get clients to tip or switch to Fanvue.,Consider offering exclusive content to encourage tipping.,1,6,winloss
conversion-failure,monetization,Failed to convert an Instagram lead to a Fanvue subscriber.,Analyze the conversation to identify areas for improvement.,1,6,another-failed-conversion-chatting-grind-continues
client-content-requests,monetization,Client requesting explicit video content with specific actions.,Ensure clarity on what can be provided and set boundaries.,1,6,need-quick-advice-from-experts
technical-constraints,tooling,The user is unsure about using a proxy for Instagram and has faced limitations without an extra phone.,Research alternative methods for accessing Instagram without a secondary device.,1,6,do-you-all-using-an-extra-phone-for-creating-instagram
slow-growth,results,The user feels their growth in followers and earnings is slow and not reflective of their efforts.,Consider adjusting content strategy or engagement methods.,1,6,first-18-days-141
subscriber-loss,monetization,The user is experiencing a decline in subscribers after an initial surge.,Analyze content performance and adjust strategies to retain subscribers.,1,6,fanvue-subs-going-down
client-trust-issues,workflow,The user is unsure how to handle clients who express interest in real-life interactions.,Set clear boundaries and communicate the nature of the service offered.,1,6,question-about-conversion
confusion-about-account-types,platform,The user is unsure whether to use a normal or professional account on Instagram.,Research the benefits of each account type to make an informed decision.,1,6,normal-vs-professional-account
miscommunication-issues,workflow,The user is confused about why a previous chat went wrong after transitioning to a paid platform.,Review chat history for context and clarify expectations.,1,6,asking-feedback-on-chat
customer-readiness,monetization,Users are uncertain if potential customers from free trials are willing to pay.,Share strategies for converting free trial users to paying customers.,1,6,fanvue-free-trial
lack-of-strategy,workflow,Users feel lost and lack a clear strategy for growing their accounts.,Provide a roadmap or strategy guide for new users.,1,6,my-ig-threads-growth-timeline-and-why-ill-never-stop-posting
platform-choice-issues,monetization,Confusion about whether to focus on Fanvue or Uncove due to differing guidelines and features.,Discuss pros and cons of each platform.,1,6,fanvue-x-uncove
customer-perception-issues,results,Worry that AI-generated content may deter customers who prefer real interactions.,Discuss ways to enhance perceived authenticity.,1,6,uncove-have-written-its-ai-content-turoff-for-customers
time-management-issues,workflow,Struggle with the time-consuming nature of chatting with subscribers.,Consider outsourcing or automating interactions.,1,6,day-10-update-new-subscription
content-creation-requests,results,"Pressure to fulfill requests for specific types of content, such as feet pics.",Discuss boundaries and comfort levels with the community.,1,6,feet-pic
image-realism-concerns,results,Concerned that AI-generated pictures may not look realistic enough for faceswap.,Experiment with different prompts to enhance realism.,1,6,what-do-you-think-3
neutral-image-generation,prompts,Wasted gems on not very realistic neutral pictures.,Seek community tips for better prompt crafting.,1,6,tips-for-prompts-and-generating-neutral-images
performance-evaluation,results,Curious if my current reel stats are good or bad and what to focus on.,Compare your stats with industry benchmarks for better insight.,1,6,question-about-statistics-views-etc
cross-platform-engagement,monetization,"Getting more comments on Threads than Instagram, struggling to lead followers to IG.",Create exclusive content on IG to incentivize followers to switch.,1,6,thread-vs-ig
content-labeling-issues,platform,"Uncertainty about whether to label posts with the AI tag on Instagram, leading to confusion.",Research community opinions or guidelines on AI labeling for better clarity.,1,6,instagram-ai-label
fear-of-exposure,results,Concern about customers feeling ripped off if they discover the model is AI.,Communicate clearly about the nature of the content.,1,6,what-if-someone-realizes-its-ai
content-clarity,results,Uncertainty about what type of content to post on the paid subscription feed.,Test different content types to see what resonates.,1,6,what-to-show-on-fanvue-feed
no-subscribers,monetization,Setting package prices but not gaining any subscribers.,Reevaluate pricing strategy or offer promotions.,1,6,package-pricing
persona-challenges,branding,Struggling with the persona attracting the right audience.,Consider adjusting the persona to be more relatable.,1,6,id-love-some-insight-from-experienced-creators-here
instagram-suspension-frustration,platform,Frustration over Instagram suspending accounts shortly after creation.,Research best practices to avoid suspension.,1,6,why-instagram-suspends-an-acconut-just-when-you-created-it-have-it-happened-to-you
inviting-issues,workflow,Struggling to convince others about the legitimacy of making money through the community.,Share success stories or testimonials to build credibility.,1,6,how-are-you-doing-with-inviting-people-here-about-the-april-empire-event-i-struggle-because-no-one-believes-me-about-making-money-this-way-lol
subscription-refusal,monetization,"The user is experiencing a high refusal rate from potential subscribers, indicating a problem with their subscription strategy.",Explore different marketing strategies or incentives to encourage subscriptions.,1,6,most-of-people-refuse-to-subscribe
uncertainty-in-nsfw-video-creation,workflow,I don't know if it's better to face swap content or generate it with AI.,Research both methods and test which yields better results.,1,6,how-do-you-do-your-nsfw-videos-of-your-model
reels-ratio-issue,tooling,User is experiencing issues with the aspect ratio of Instagram reels.,Ensure videos are uploaded in the correct format.,1,6,problems-with-reels-ratio
image-quality,tooling,"The user is dissatisfied with the image quality generated by Pykaso, finding it inconsistent.",Explore alternative tools or adjust settings for better results.,1,6,pykaso-4
image-color-temperature,results,User is looking for a way to adjust the color temperature of their images to avoid them being too dark.,Experiment with image editing tools to adjust brightness and contrast.,1,5,nsfw18
nsfw-creation-help,workflow,Struggling to create NSFW content using face swap.,Seek tutorials or community tips on NSFW generation techniques.,1,5,need-help-2458232e
glitch-issues,results,Experiencing glitches with eye colors in generated images.,Report the issue to support for further investigation.,1,5,eye-color-glitches-thoughts-on-pykaso-generations-pricing
hiring-challenges,workflow,User is struggling to find skilled chatters for their platform.,Explore specialized platforms for hiring experienced chatters.,1,5,how-the-hell-do-you-hire-good-chatters
identity-verification-delay,platform,User is experiencing a delay in identity verification after submitting required documents.,Contact support for assistance with verification.,1,5,uncove-stuck-on-identify-verification
ghosting-issues-in-ppv-sales,workflow,User is experiencing ghosting from potential customers while trying to sell PPV content.,Consider adjusting outreach strategies or messaging.,1,5,they-keep-ghosting-and-ignoring-me
banned-account-issues,platform,"User's FanVue account was banned shortly after opening, leading to confusion about subscriber sources.",Contact support for clarification on account status.,1,5,do-you-know-that-abkut-fanvue
automation-tool-requirements,tooling,User is looking for a tool to automate posts and stories but needs advice on setup.,Research automation tools that fit your content strategy.,1,5,tool-for-automated-posts-and-stories
content-ownership-concerns,platform,User is worried about potential repercussions from face-swapping content being credited to original posters.,Review content creation guidelines to avoid issues.,1,5,were-cooked
advertising-struggles,monetization,Struggling to find effective platforms for advertising models to attract customers.,Explore alternative social media platforms or niche communities.,1,5,advertising
video-creation-options,tooling,Looking for better free options for creating videos or upscaling photos.,Research free video editing and upscaling tools available online.,1,5,anyone-has-a-better-free-option-on-creating-videos-or-upscaling-photos
client-engagement-issues,monetization,Feeling that many clients only want free content and not willing to pay.,Implement strategies to filter serious clients from time-wasters.,1,5,how-can-i-filter-the-time-wasters
hiring-chatter-issues,workflow,Uncertainty about where to find good chatters for immediate hiring.,Network within the community or seek recommendations.,1,5,if-i-want-to-hire-a-chatter-from-the-get-go
login-issues,platform,Experiencing login issues with Fanvue after verifying identity.,Contact support for assistance with login problems.,1,5,do-you-know-what-to-do-here
platform-bans,platform,"Facing bans on Instagram and TikTok, affecting social media growth.",Review content guidelines to avoid future bans.,1,5,instagram-and-tiktok-bans
client-disappointment,monetization,Clients are disappointed with the content delivered versus their expectations.,Clarify what is included in each content package before selling.,1,5,whats-included
account-selection-issues,platform,Uncertainty about whether to use aged or fresh Instagram accounts.,Consider the pros and cons of each option based on your goals.,1,5,would-you-aged-account-or-fresh-new
lack-of-early-sales,monetization,The user has not made any sales after two weeks of effort.,Evaluate marketing strategies and consider promotional tactics.,1,5,how-long-did-it-took-you-to-make-your-first-dollar
account-warm-up-struggles,workflow,The user is struggling with the process of warming up their account.,Seek advice on effective warm-up strategies from experienced users.,1,5,what-is-your-struggle-right-now-mine-is-trying-to-warm-up-the-account
conflicting-advice,workflow,The user is confused about whether to engage in chatting on Instagram.,Test both approaches to see which yields better results.,1,5,ig-chat-or-no-chat
frustration-with-no-sales,monetization,The user is frustrated after a week of effort without making any sales.,Reassess marketing strategies and consider promotional efforts.,1,5,one-week-in-0-made-but-im-not-quitting
upload-limitations,platform,Users are unable to complete ID verification due to upload restrictions.,Clarify upload requirements or increase limits.,1,5,identification
paid-ads-availability,monetization,"Uncertainty about whether platforms like OnlyFans, Fanvue, or Uncove offer paid ads to promote models directly.",Check the advertising policies of each platform.,1,5,paid-promotion
dm-connection-issues,workflow,Concern about the appropriateness of DMing potential customers first on Instagram.,Consider community feedback on best practices.,1,5,can-i-dm-the-customers-first-on-ig
customer-engagement-strategies,workflow,Seeking effective strategies for engaging potential customers through comments.,Share successful engagement tactics.,1,5,question-a7afd322
scam-concerns,monetization,Skepticism about the legitimacy of promotional offers.,Share personal experiences with promotions.,1,5,has-someone-tried-promo
voice-generator-recommendation,tooling,"Looking for a good, preferably free AI voice generator.",Check online forums for user recommendations.,1,5,voice-generators
customer-notes-strategy,workflow,Looking for strategies to take good notes about customers without making rookie mistakes.,Use a simple template to capture essential customer information.,1,5,are-u-guys-having-notes-about-customers
internet-issues,platform,"Had no internet for 3 days, and now my Instagram and Threads accounts are dead.",Consider creating a new account if recovery isn't possible.,1,5,help-1451c760
following-error,platform,Getting an error when trying to follow other influencers during IG warmup.,Follow influencers through reels instead of their pages.,1,5,cant-follow-anyone-on-ig
time-management,workflow,"Managing a high volume of DMs and chats with followers can be overwhelming, especially for someone with a full-time job.",Consider using chat automation tools to streamline communication.,1,5,whats-the-time-commitment
platform-comparison-issues,platform,"Seeking clarity on the differences between Uncove and Fanvue, including potential issues with both.",Research user experiences and reviews to make an informed decision.,1,5,uncove-vs-fanvue-2
harassment-issues,platform,User received unsolicited provocative messages before posting any content.,Consider adjusting privacy settings or blocking users.,1,5,dirty-messages-before-i-even-posted
24-7-chat-service,tooling,Need for a service to manage chatting across multiple platforms 24/7.,Look into chat automation tools or hiring virtual assistants.,1,5,horny-chat
training-ai-model,tooling,Uncertainty about how to keep the AI model in a consistent setting.,Explore training techniques for consistency.,1,5,question-506112be
ppv-feature-issues,tooling,"The new PPV feature is not working reliably, with results not matching prompts.",Reach out to support for troubleshooting or check for user guides.,1,5,pykaso-ppv
finding-nsfw-content,tooling,Struggling to find NSFW photos and videos that match the AI model's body type.,Look for specific websites or communities that curate NSFW content.,1,5,nsfw-content-2
reels-content-guidelines,results,"Confusion about whether text in reels refers to on-screen text or comments, and if music is allowed.",Clarify content guidelines for reels with the platform.,1,5,reels-2
usa-sim-acquisition,tooling,Uncertainty about how to obtain a USA SIM for creating a targeted Instagram account.,Ask for recommendations on reliable sources for USA SIM cards.,1,5,help-me-usa-sim-question
training-error-issues,results,"Encountering errors during AI training on Pykaso, affecting model development.",Seek troubleshooting tips for common training errors.,1,5,what-do-to-keep-getting-error-when-i-do-ai-training-on-pykaso
uncove-signup-issues,platform,Frustration with the Uncove signup process and seeking alternatives.,Explore other platforms with faster verification processes.,1,5,uncove-3
verification-time-issues,platform,Waiting for ID verification on Uncove for an extended period.,Inquire about typical verification times from other users.,1,5,uncove-verified-process
follower-obsession-issues,workflow,Dealing with an overly persistent follower who wants to meet in person.,Establish boundaries and communicate them clearly.,1,5,issues-with-instagram-followers
model-appeal-concerns,results,Concern that the model's appearance is too attractive and not relatable enough.,Consider creating a more relatable model to appeal to a broader audience.,1,5,after-april-9th-call-i-realized-my-model-is-too-hot-and-she-has-late-20s-look
background-consistency-issues,results,Struggling to maintain background consistency when moving the model in images.,Seek techniques for background editing and consistency.,1,5,how-to-keep-background-consistent
fixing-image-flaws,tooling,"The user is looking for an easy tool to correct flaws in AI-generated images, particularly hands.",Explore user-friendly apps or tools specifically designed for image correction.,1,5,editor-correcting-hands-and-flaws
training-image-selection,results,The user is unsure about the best approach to training their AI model with nude images.,Seek advice on training methodologies from experienced users.,1,5,training
upscale-settings,tooling,The user is confused about the correct settings for upscaling images.,Look for community-shared settings or guidelines for optimal upscaling.,1,5,help-how-to-upscale
training-not-working,results,The user is facing issues with the training process where nothing happens after uploading images.,Check for any errors in the upload process or seek troubleshooting tips.,1,5,lora-training
face-swap-consequences,results,"The user faced negative consequences from using face swap on makeup videos, indicating a potential risk.",Advise caution when using face swap features in sensitive contexts.,1,5,face-swap-on-girls-make-up-videos-bad-idea
creating-pay-links,monetization,User is unsure how to create pay links.,Ask for examples or guides from experienced users.,1,5,pay-links
accessing-content,monetization,"Users are seeking ways to access OnlyFans content for free, which raises concerns about legality and ethics.",Consider offering promotional content or discounts to attract subscribers.,1,5,free-onlyfans
payment-delay,monetization,The user is uncertain about the time it takes for funds to arrive in their Coinbase wallet.,Check with Coinbase support for estimated transfer times.,1,5,i-need-help-with-pykasocoinbase
platform-usage,tooling,The user is struggling to utilize Seduced.com effectively for content creation.,Seek community tips or tutorials on maximizing platform features.,1,5,stuck-seeking-expert-guidance-on-seducedcomany-help-appreciated
content-creation,monetization,The user is struggling to create exclusive content that can be sold.,Collaborate with others or seek inspiration from successful models.,1,5,any-tips-for-exclusief-content-to-sell
rendering-issues,results,The user is having issues rendering fingers in their model.,Experiment with different rendering techniques or settings.,1,4,need-some-feedback-on-my-model-especially
kling-issues,tooling,"There is no reference guide for Kling, and it burns credits without good results.",Look for community guides or tutorials to better understand the tool.,1,4,klingit-sucks-there-i-said-it
overwhelmed-by-dms,workflow,Receiving too many DMs is overwhelming and time-consuming to manage.,Consider using automation tools to streamline responses.,1,4,getting-a-ton-of-dms
misunderstanding-process,workflow,Confusion about the warm-up process and interaction requirements.,Clarify the steps with community or documentation.,1,4,question-about-threads-warmup
fanvue-account-setup,onboarding,User is confused about which account creation option to choose on FanVue.,Research the differences between the options or seek advice from experienced users.,1,4,fanvue-account-creation-2
fanvue-offer-delays,monetization,User has not received promised likes and blue tick from Fanvue after a long wait.,Follow up with Fanvue support for updates on the offer.,1,4,fanvue-2k-likes-and-the-blue-tick
account-deletion,platform,"User's Fanvue account shows 'page not found' when shared, indicating a potential deletion or accessibility issue.",Contact Fanvue support for assistance.,1,4,fanvue-deleted
content-selection-issue,tooling,The user is confused about the removal of SDXL PPV content from Pykaso and is looking for alternatives.,Research current alternatives or updates from Pykaso.,1,4,sdxl-ppv-on-pykaso-still-possible
video-creation-issue,tooling,The user is looking for ways to create short sexy videos but is limited by current tools.,Explore alternative platforms that allow for short video creation.,1,4,sexy-ai-videos
upload-issue,tooling,"Reference photos are not uploading, causing delays.",Check internet connection or try a different browser.,1,4,stuck-on-loading
model-issue,tooling,Missing stem on the generated wine glass model.,Adjust the model parameters to include stem details.,1,4,missing-stem
location-consistency-issue,tooling,Images always appear in the same room despite specifying different locations.,Add diverse reference photos to the training set.,1,4,always-in-her-room
level-access-issue,platform,Uncertainty about attending the live session without being level 3.,Check the requirements for participation in advance.,1,4,question-7c6a2adc
image-optimization-issue,tooling,Need suggestions for optimizing banner image for Fanvue.,Research best practices for image dimensions and quality.,1,4,banner-image-for-fanvue
model-improvement-issues,feedback,The user is seeking feedback on their first model and how to improve it.,Ask for specific feedback on features or aspects of the model.,1,4,1st-model-what-do-you-guys-think
training-option-missing,tooling,Unable to load photos for training in Pykaso due to missing options.,Check for updates or consult the community for workarounds.,1,4,cant-train-girl-in-pykaso
editing-software-issues,tooling,Need a program to edit NSFW pictures with specific overlap issues.,Look for specialized editing software that supports NSFW content.,1,4,program-to-edit-nsfw-pcitures
video-prompt-issues,tooling,User is struggling to find suitable prompts for video creation.,Collaborate with others for prompt ideas.,1,4,my-first-2-videos-with-my-new-model
clothing-consistency,results,The user wants to maintain the same clothing on their AI models for consistency.,Explore training techniques that focus on clothing retention.,1,4,keeping-same-t-shirt
organic-growth-challenges,monetization,User is struggling to gain followers organically on social media.,Explore targeted engagement strategies and content promotion.,1,4,how-to-gain-more-followers-on-threads-ig
ineffective-mass-dm,monetization,User has not seen results from mass DM efforts after three days.,Reassess DM strategy and consider more targeted approaches.,1,4,mass-dm-1085bde6
dm-tool-access,tooling,User is looking for the masterclass DM tool but cannot find it.,Ask the community for guidance on locating the tool.,1,4,the-dm-tool
